Date,Title,EngTitle,JapEngTitle
2020-03-27 17:08:00,서정진 셀트리온 회장 “오는 3·4분기 셀트리온그룹 3사 합병안 제시...,"Seo Jeong-jin, Chairman of Celltrion, “Suggested a merger plan for the three Celltrion Group companies in the third quarter...",서정진 셀트리온 회장 “오는 3·4분기 셀트리온그룹 3사 합병안 제시...
2020-03-27 17:05:00,"서정진 ""셀트리온 3사 합병안 하반기 가시화""…효율성 제고","Seo Jeong-jin ""Visible in the second half of the merger plan for the three Celltrion companies""... Increase efficiency","서정진 ""셀트리온 3사 합병안 하반기 가시화""…효율성 제고"
2020-03-27 13:58:00,"서정진 셀트리온 회장 ""올 3~4분기 합병 방안 제시할 것""","Celltrion Chairman Seo Jeong-jin ""We will propose a merger plan for the 3rd and 4th quarters of this year""","서정진 셀트리온 회장 ""올 3~4분기 합병 방안 제시할 것"""
2020-03-27 13:02:00,"셀트리온 서정진 ""은퇴는 예정대로…3사 합병안 3~4분기 제시""","Celltrion Seo Jeong-jin ""Retirement is as planned... 3rd and 4th quarter of merger proposals""","셀트리온 서정진 ""은퇴는 예정대로…3사 합병안 3~4분기 제시"""
2020-03-27 13:00:00,"셀트리온 3사 합병안 3~4분기 제시…서정진 ""주주들 설득할 것""","Proposal for the merger of the three Celltrion companies in the 3rd and 4th quarters... Seo Jeong-jin ""I will persuade shareholders""","셀트리온 3사 합병안 3~4분기 제시…서정진 ""주주들 설득할 것"""
2020-03-27 14:05:00,"코로나 퇴치 앞장선 셀트리온, '주주총회' 이렇게 치렀다","Celltrion, a leader in eradicating corona, held a'general shareholders' meeting like this","코로나 퇴치 앞장선 셀트리온, '주주총회' 이렇게 치렀다"
2020-03-27 12:59:00,셀트리온 기우성 대표 '3연임'…램시마 해외진출 공 인정,Celltrion CEO Woo-sung Ki '3 consecutive days'… Remshima recognized for overseas expansion,셀 트리온 기우성 대표 '3 연임'… 램시 마 해외 진출 공 인정
2020-03-27 08:55:00,"셀트리온, 코로나19 치료제 개발 및 올해 실적 성장 기대",Celltrion develops COVID-19 treatment and expects earnings growth this year,"셀 트리온, 코로나 19 치료제 개발 및 올해 실적 성장 기대"
2020-03-27 08:30:00,"셀트리온, 코로나19 치료제 개발과 본격 성장..목표가↑-한화",Celltrion develops COVID-19 treatment and grows in earnest.. Goal↑-Hanwha,"셀트 리온, 코로나 19 치료제 개발과 본격 성장 .. 목표가 ↑-한화"
2020-03-26 15:25:00,"국립보건연구원, 셀트리온·SK바이오와 코로나19 치료제·백신 개발","National Institute of Health, Celltrion, SK Bio and Corona 19 treatment and vaccine development",国立保健研究所、セルトリオン・SKバイオコロナ19治療剤・ワクチンの開発
2020-03-26 14:14:00,"질본, 셀트리온·SK바이오사이언스와 코로나19 치료제·백신 개발","Zilbon, Celltrion, SK Bioscience and Corona 19 Treatment and Vaccine Development","질본, 셀트 리온 · SK 바이 오사 이 언스 와 코로나 19 치료제 · 백신 개발"
2020-03-26 14:10:00,백신개발 파트너로 셀트리온·SK바이오 선정,Celltrion SK Bio selected as vaccine development partner,ワクチン開発のパートナーとしてセルトリオン・SKバイオ選定
2020-03-26 11:23:00,코로나 치료 정부용역 따낸 셀트리온…3대 투자포인트는?,Celltrion won government service for corona treatment... What are the three investment points?,코로나 치료 정부용역 따낸 셀트리온…3대 투자포인트는?
2020-03-24 18:36:00,"24일, 외국인 거래소에서 삼성전자(+10.47%), 셀트리온(+5.1...","24일, 외국인 거래소에서 삼성전자(+10.47%), 셀트리온(+5.1...","On the 24th, Samsung Electronics (+ 10.47%), Celltrion (+5.1 ..."
2020-03-24 11:15:00,"금융위기 때도 오른 셀트리온, 코로나 급락장서도 강하네","Celltrion, which rose even during the financial crisis, is also strong in corona","금융위기 때도 오른 셀 트리온, 코로나 급락 장서 도 강하네"
2020-03-24 09:32:00,"'코로나19' 치료제 개발, 셀트리온 3형제 강세…셀트리온제약 '급등...","'Corona 19' drug development, Celltrion 3 brothers strong Celltrion Pharmaceutical'surges...",「コロナ19 '治療剤の開発、セルトリオン3兄弟高...セルトリオン製薬「急騰...
2020-03-24 09:20:00,"셀트리온 그룹주, 코로나 치료 항체 구축 소식에 강세",Celltrion Group Shares Strong on News of Corona Treatment Antibody Construction,"셀트리온 그룹주, 코로나 치료 항체 구축 소식에 강세"
2020-03-24 09:13:00,코로나19 정조준..셀트리온 3형제 강세,Corona 19 positive aiming.. Celltrion 3 brothers strong,コロナ19照準。セルトリオン3兄弟高
2020-03-24 09:36:00,[특징주]코로나19 치료제 개발 기대감...셀트리온 3형제 강세,[Features] Expectations to develop a treatment for Corona 19... 3 Celltrion brothers are strong,[Tukjinju] Expectations for the development of Corona 19 therapeutic agent ... Celltrion 3 Brothers High School
2020-03-24 09:11:00,"[특징주]셀트리온 3형제, 코로나19 치료제 개발 소식에 강세",[Features] Celltrion's 3 brothers are strong on the news of the development of COVID-19 treatment,"[특징주]셀트리온 3형제, 코로나19 치료제 개발 소식에 강세"
2020-03-27 08:30:00,"셀트리온, 코로나19 치료제 개발과 본격 성장..목표가↑-한화",Celltrion develops COVID-19 treatment and grows in earnest.. Goal↑-Hanwha,"셀트리온, 코로나19 치료제 개발과 본격 성장..목표가↑-한화"
2020-03-26 15:25:00,"국립보건연구원, 셀트리온·SK바이오와 코로나19 치료제·백신 개발","National Institute of Health, Celltrion, SK Bio and Corona 19 treatment and vaccine development","국립 보건 연구원, 셀 트리온 · SK 바이 오와 코로나 19 치료제 · 백신 개발"
2020-03-26 14:14:00,"질본, 셀트리온·SK바이오사이언스와 코로나19 치료제·백신 개발","Zilbon, Celltrion, SK Bioscience and Corona 19 Treatment and Vaccine Development","Development of Zilbon, Celltrion SK Biosciences and Corona 19 Therapeutic Agents / Vaccines"
2020-03-26 14:10:00,백신개발 파트너로 셀트리온·SK바이오 선정,백신개발 파트너로 셀트리온·SK바이오 선정,백신 개발 파트 너로 셀 트리온 · SK 바이오 선정
2020-03-26 11:23:00,코로나 치료 정부용역 따낸 셀트리온…3대 투자포인트는?,Celltrion won government service for corona treatment... What are the three investment points?,Corona treatment The celltrion that won the government role ... What are the points of the three major investments?
2020-03-24 18:36:00,"24일, 외국인 거래소에서 삼성전자(+10.47%), 셀트리온(+5.1...","On the 24th, Samsung Electronics (+10.47%), Celltrion (+5.1...","On the 24th, Samsung Electronics (+ 10.47%), Celltrion (+5.1 ..."
2020-03-24 11:15:00,"금융위기 때도 오른 셀트리온, 코로나 급락장서도 강하네","Celltrion, which rose even during the financial crisis, is also strong in corona","Celltrion and Corona Guprakjan, who went up during the financial crisis, are also strong."
2020-03-24 09:32:00,"'코로나19' 치료제 개발, 셀트리온 3형제 강세…셀트리온제약 '급등...","'Corona 19' drug development, Celltrion 3 brothers strong Celltrion Pharmaceutical'surges...","""Corona 19'Development of Therapeutic Agent, Celltrion 3 Brothers High ... Celltrion Pharmaceutical"" Soaring ..."
2020-03-24 09:20:00,"셀트리온 그룹주, 코로나 치료 항체 구축 소식에 강세",Celltrion Group Shares Strong on News of Corona Treatment Antibody Construction,Sertorion Groupge bullish on news of building corona therapeutic antibodies
2020-03-24 09:13:00,코로나19 정조준..셀트리온 3형제 강세,Corona 19 positive aiming.. Celltrion 3 brothers strong,Corona 19 aiming. Celltrion 3 Brothers High
2020-03-24 09:36:00,[특징주]코로나19 치료제 개발 기대감...셀트리온 3형제 강세,[Features] Expectations to develop a treatment for Corona 19... 3 Celltrion brothers are strong,[특징주] 코로나 19 치료제 개발 기대감 ... 셀트 리온 3 형제 강세
2020-03-24 09:11:00,"[특징주]셀트리온 3형제, 코로나19 치료제 개발 소식에 강세",[Features] Celltrion's 3 brothers are strong on the news of the development of COVID-19 treatment,"[Tukjinju] Celltrion 3 brothers, bullish on news of development of Corona 19 therapeutic agent"
2020-03-24 09:15:00,"[이데일리N] 셀트리온 “코로나19 치료제, 7월 임상 목표” 外","[EDaily N] Celltrion “Corona 19 treatment, clinical target for July”, etc.","[이데 일리 N] 셀트 리온 “코로나 19 치료제, 7 월 임상 목표” Outside"
2020-03-24 09:12:00,"[특징주] 셀트리온그룹 3사, 코로나19 중화항체 개발 진전 소식에 강...",[Features] Celltrion Group's 3 companies are strong on the news of progress in the development of COVID-19 neutralizing antibodies...,"[Tukjinju] Three Sertorion Group companies, river in news of progress in development of corona 19 neutralizing antibody ..."
2020-03-24 09:08:00,"'셀트리온' 5% 이상 상승, 전일 외국인 대량 순매수","'Celltrion' increased by more than 5%, mass net purchase by foreigners the previous day","""Celltrion"" increased by more than 5%, mass net purchases of foreigners the day before"
2020-03-24 04:06:00,"셀트리온, 자가면역질환 치료제 `램시마SC`…유럽 이어 美·캐나다 진출","Celltrion, autoimmune disease treatment'Remsima SC'... Advancing into the US and Canada following Europe","셀트 리온, 자가면 역질환 치료제 `램시 마SC`… 유럽 이어 Beauty 캐나다 진출"
2020-03-24 09:15:00,"[이데일리N] 셀트리온 “코로나19 치료제, 7월 임상 목표” 外","[EDaily N] Celltrion “Corona 19 treatment, clinical target for July”, etc.","[EDAILY N] Celltrion ""Corona 19 treatment, clinical goal in July"" outside"
2020-03-24 09:13:00,코로나19 정조준..셀트리온 3형제 강세,Corona 19 positive aiming.. Celltrion 3 brothers strong,Corona 19 aiming. Celltrion 3 Brothers High
2020-03-24 09:12:00,"[특징주] 셀트리온그룹 3사, 코로나19 중화항체 개발 진전 소식에 강...",[Features] Celltrion Group's 3 companies are strong on the news of progress in the development of COVID-19 neutralizing antibodies...,"[특징주] 셀트리 온그룹 3사, 코로나 19 중화 항체 개발 진전 소식 에"
2020-03-24 09:11:00,"[특징주]셀트리온 3형제, 코로나19 치료제 개발 소식에 강세",[Features] Celltrion's 3 brothers are strong on the news of the development of COVID-19 treatment,"[Tukjinju] Celltrion 3 brothers, bullish on news of development of Corona 19 therapeutic agent"
2020-03-24 09:08:00,"'셀트리온' 5% 이상 상승, 전일 외국인 대량 순매수","'Celltrion' increased by more than 5%, mass net purchase by foreigners the previous day",「セルトリオン「5％以上上昇し、前日の外国人の大量買い越し
2020-03-24 04:06:00,"셀트리온, 자가면역질환 치료제 `램시마SC`…유럽 이어 美·캐나다 진출","Celltrion, autoimmune disease treatment'Remsima SC'... Advancing into the US and Canada following Europe","Celltrion, a therapeutic agent for autoimmune diseases `Lamu SC` ... Europe continued beauty / Canada advancement"
2020-03-23 18:53:00,“코로나 치료제 1단계 개발 완료”…셀트리온 삼총사 주가 급등,“Completed development of the first stage of corona treatment”… Celltrion's stock price surge,"""Development of one stage of corona therapeutic drug completed"" ... Celltrion three musketeers stock price soars"
2020-03-23 16:49:00,[종합]서정진 셀트리온 회장 “코로나 치료제 7월말 인체 임상”,"[Comprehensive] Jeong-jin Seo, Chairman of Celltrion, “Corona treatment in human body at the end of July”",[종합] 서정진 셀 트리온 회장 “코로나 치료제 7 월말 인체 임상”
2020-03-23 16:12:00,"서정진 셀트리온 회장 ""코로나19 항체후보 300종 확보…7월 인체투...","Celltrion Chairman Seo Jeong-jin ""Secured 300 Corona 19 antibody candidates...",ソ・ジョンジンセルトリオン会長「コロナ19抗体候補300種確保... 7月の人体ツー...
2020-03-23 18:37:00,"23일, 외국인 거래소에서 셀트리온(+14.75%), TIGER 200...","On the 23rd, Celltrion (+14.75%), TIGER 200...","On the 23rd, at the foreign exchange, Celltrion (+ 14.75%), TIGER 200 ..."
2020-03-23 18:23:00,셀트리온 “4개월 내 코로나19 치료제 내놓겠다”…두 달 앞당겨(종합),셀트리온 “4개월 내 코로나19 치료제 내놓겠다”…두 달 앞당겨(종합),셀트리온 “4개월 내 코로나19 치료제 내놓겠다”…두 달 앞당겨(종합)
2020-03-23 17:41:00,"셀트리온 ""코로나19 치료제 7월 말까지 전임상 완료할 것""","Celltrion ""Corona 19 treatment to be completed by the end of July""","Celltrion ""Corona 19 treatment to be clinically completed by the end of July"""
2020-03-23 16:48:00,"서정진 셀트리온 회장 “코로나19 치료제, 7월말 인체투여 목표”(상...","서정진 셀트리온 회장 “코로나19 치료제, 7월말 인체투여 목표”(상...","서정진 셀 트리온 회장 “코로나 19 치료제, 7 월말 인체 투여 목표” (상 ..."
2020-03-23 16:01:00,"서정진 셀트리온 회장 ""코로나 치료제, 두 달 당겨 7월 환자 투여""","서정진 셀트리온 회장 ""코로나 치료제, 두 달 당겨 7월 환자 투여""","서정진 셀트리온 회장 ""코로나 치료제, 두 달 당겨 7월 환자 투여"""
2020-03-23 18:07:00,"[전문] 서정진 셀트리온 회장 ""코로나 치료제 한달 100만명 분 생산...","[Professional] Seo Jeong-jin, Chairman of Celltrion, ""produces 1 million people per month for corona treatment...","[Specialty] Chairman Seo Jung Jin Sertorion ""Production for 1 million people per month for corona treatment ..."
2020-03-23 16:56:00,"셀트리온 ""코로나19 치료제 7월말 인체 투약""","셀트리온 ""코로나19 치료제 7월말 인체 투약""",セルトリオン「コロナ19治療7月末人体投薬」
2020-03-23 16:52:00,"서정진 셀트리온 회장 ""코로나19 항체치료제 후보 확보…7월말 임상 ...","Seo Jeong-jin, Chairman of Celltrion, ""Corona 19 antibody treatment candidates secured... clinical trial at the end of July...","Chairman Seo Jong Jin Sertorion ""Securing Candidates for Corona 19 Antibody Treatment ... Clinical Practice at the End of July ..."
2020-03-23 17:56:00,코로나19 치료제 개발 기대...'셀트리온 3형제' 급반등,Expectations to develop COVID-19 treatment...,"Expectations for the development of Corona 19 therapeutic agent ... ""Celltrion 3 brothers"" class repulsion"
2020-03-23 17:41:00,"셀트리온 ""코로나19 치료제 7월 말까지 전임상 완료할 것""","Celltrion ""Corona 19 treatment to be completed by the end of July""","Celltrion ""Corona 19 treatment to be clinically completed by the end of July"""
2020-03-23 16:48:00,"서정진 셀트리온 회장 “코로나19 치료제, 7월말 인체투여 목표”(상...",Celltrion Chairman Seo Jeong-jin “Corona 19 treatment target for human administration at the end of July”,ソ・ジョンジンセルトリオン会長「コロナ19治療、7月末人体投与目標」（上...
2020-03-23 16:01:00,"서정진 셀트리온 회장 ""코로나 치료제, 두 달 당겨 7월 환자 투여""","Seo Jeong-jin, Chairman of Celltrion, ""Corona treatment, administered two months to July patients""","Chairman Seo Jong Jin Sertorion ""Corona treatment, two months later, administered to patients in July"""
2020-03-23 17:04:00,"[공시] 셀트리온, 조홍희 사외이사 중도퇴임","[Disclosure] Celltrion, Cho Hong-hee, outside director withdrawal",[Public announcement] Celltrion retires from outside director Johonhui
2020-03-23 16:56:00,"셀트리온 ""코로나19 치료제 7월말 인체 투약""","Celltrion ""Corona 19 treatment administered to human body at the end of July""","Celltrion ""Corona 19 Treatment End of July Human Medication"""
2020-03-23 16:52:00,"서정진 셀트리온 회장 ""코로나19 항체치료제 후보 확보…7월말 임상 ...","서정진 셀트리온 회장 ""코로나19 항체치료제 후보 확보…7월말 임상 ...","Chairman Seo Jong Jin Sertorion ""Securing Candidates for Corona 19 Antibody Treatment ... Clinical Practice at the End of July ..."
2020-03-23 16:49:00,[종합]서정진 셀트리온 회장 “코로나 치료제 7월말 인체 임상”,"[Comprehensive] Jeong-jin Seo, Chairman of Celltrion, “Corona treatment in human body at the end of July”","[Comprehensive] Chairman Seo Jung Jin Sertorion ""Corona Treatment End of July Human Body Clinical"""
2020-03-23 16:12:00,"서정진 셀트리온 회장 ""코로나19 항체후보 300종 확보…7월 인체투...","Celltrion Chairman Seo Jeong-jin ""Secured 300 Corona 19 antibody candidates...",ソ・ジョンジンセルトリオン会長「コロナ19抗体候補300種確保... 7月の人体ツー...
2020-03-23 16:14:00,"서정진 ""7월 말까지 코로나 치료제 임상 목표""…셀트리온 3형제 급등","Seo Jeong-jin ""Clinical target for corona treatment by the end of July""... Celltrion 3 brothers soared","Seo Jung-jin ""Clinical Goals for Corona Treatment by the End of July"" ... Celltrion 3 Brothers Soar"
2020-03-23 15:42:00,"셀트리온 ""코로나 치료제, 7월 말 인체투여 목표""(속보)","셀트리온 ""코로나 치료제, 7월 말 인체투여 목표""(속보)","셀트 리온 ""코로나 치료제, 7 월 말 인체 투여 목표"" (속보)"
2020-03-23 15:47:00,"셀트리온 “코로나 진단키트, 5월 말 임상 완료 목표”(속보)","Celltrion “Corona diagnostic kit, target for clinical completion in late May”","Celltrion ""Corona Diagnostic Kit, Clinical Completion Goal at End of May"" (flash report)"
2020-03-23 14:57:00,셀트리온 15% 급등… 장마감 후 코로나 치료제 개발현황 발표,Celltrion surged 15%... Announcement of Corona Treatment Development Status,셀트 리온 15% 급등… 장마감 후 코로나 치료제 개발 현황 발표
2020-03-23 14:46:00,[특징주]하락장서 상승하는 '셀트리온 3형제',[Features] '3 Celltrion Brothers' Rising in the Fall,"[Tukjinju] Falling books rise ""Celltrion 3 brothers"""
2020-03-23 11:20:00,"셀트리온제약 등 `셀트리온 3형제`, 코로나19 치료제 개발 기대로 ...","Celltrion Pharm, etc.'3 Celltrion Brothers' Expectations to Develop Corona 19 Treatment ...","셀 트리 온제 약 등 `셀 트리온 3 형제`, 코로나 19 치료제 개발 기대로 ..."
2020-03-23 11:15:00,셀트리온 3형제 급등…장 마감 후 코로나19 치료제 개발 현황 발표,Celltrion's 3 brothers soared... Announcement of the development status of COVID-19 treatment after the market closes,"Celltrion 3 brothers soar ... After the deal closes, the current status of development of Corona 19 therapeutic agent is announced"
2020-03-23 10:04:00,[특징주]폭락장에서도 셀트리온 연일 강세,[Features] Celltrion is strong in the crash market every day,[Tukjinju] Pokurakujan is also a celltrion every day
2020-03-23 09:49:00,'코로나19 치료제' 간담회 앞두고 셀트리온 3사 급등…셀트리온제약 ...,Three Celltrion companies surged ahead of the'Corona 19 treatment' conference... Celltrion Pharmaceuticals ...,「コロナ19治療薬「懇談会控えセルトリオン3社急騰...セルトリオン製薬...
2020-03-23 14:07:00,"[특징주] 셀트리온 3총사, 코로나19 치료제 개발 관련 간담회 앞두고...","[Features] Ahead of a conference on the development of COVID-19 treatment, the 3 Celltrion","[특징 주] 셀 트리온 3 총사, 코로나 19 치료제 개발 관련 간담 회 앞두고 ..."
2020-03-23 10:17:00,"[특징주]셀트리온3인방, 코로나19 치료제 간담회 기대감 '동반 강세...","[Features] Three Celltrion members, expectation of a meeting for COVID-19 treatment'companion strong...","[Tukjinju] Three Celltrions, high expectations for the Corona 19 Treatment Roundtable ..."
2020-03-23 13:27:00,코스피 장중 1500 회복…'셀트리온 3형제' 강세,Kospi intraday 1500 recovery... '3 Celltrion brothers' strong,"1500 recovery during KOSPI trading hours ... ""Celltrion 3 Brothers"" High"
2020-03-23 15:47:00,"셀트리온 “코로나 진단키트, 5월 말 임상 완료 목표”(속보)","Celltrion “Corona diagnostic kit, target for clinical completion in late May”","Celltrion ""Corona Diagnostic Kit, Clinical Completion Goal at End of May"" (flash report)"
2020-03-23 15:42:00,"셀트리온 ""코로나 치료제, 7월 말 인체투여 목표""(속보)","Celltrion ""Corona treatment target for human administration at the end of July"" (Breaking News)","Celltrion ""Corona treatment, target for human administration at the end of July"" (flash report)"
2020-03-23 14:57:00,셀트리온 15% 급등… 장마감 후 코로나 치료제 개발현황 발표,Celltrion surged 15%... Announcement of Corona Treatment Development Status,"Celltrion soars 15% ... After the deal closes, the current status of corona treatment development is announced"
2020-03-23 14:46:00,[특징주]하락장서 상승하는 '셀트리온 3형제',[특징주]하락장서 상승하는 '셀트리온 3형제',"[Tukjinju] Falling books rise ""Celltrion 3 brothers"""
2020-03-23 11:20:00,"셀트리온제약 등 `셀트리온 3형제`, 코로나19 치료제 개발 기대로 ...","Celltrion Pharm, etc.'3 Celltrion Brothers' Expectations to Develop Corona 19 Treatment ...","Expecting the development of `Celltrion 3 brothers`, Corona 19 therapeutic agents such as Celltrion Pharmaceutical ..."
2020-03-23 11:15:00,셀트리온 3형제 급등…장 마감 후 코로나19 치료제 개발 현황 발표,셀트리온 3형제 급등…장 마감 후 코로나19 치료제 개발 현황 발표,셀 트리온 3 형제 급등… 장 마감 후 코로나 19 치료제 개발 현황 발표
2020-03-23 10:04:00,[특징주]폭락장에서도 셀트리온 연일 강세,[Features] Celltrion is strong in the crash market every day,[Tukjinju] Pokurakujan is also a celltrion every day
2020-03-23 09:49:00,'코로나19 치료제' 간담회 앞두고 셀트리온 3사 급등…셀트리온제약 ...,Three Celltrion companies surged ahead of the'Corona 19 treatment' conference... Celltrion Pharmaceuticals ...,「コロナ19治療薬「懇談会控えセルトリオン3社急騰...セルトリオン製薬...
2020-03-23 14:07:00,"[특징주] 셀트리온 3총사, 코로나19 치료제 개발 관련 간담회 앞두고...","[특징주] 셀트리온 3총사, 코로나19 치료제 개발 관련 간담회 앞두고...","[Tukjinju] Celltrion 3 Musketeer, Corona 19 Ahead of a roundtable discussion related to the development of a therapeutic agent ..."
2020-03-23 10:17:00,"[특징주]셀트리온3인방, 코로나19 치료제 간담회 기대감 '동반 강세...","[Features] Three Celltrion members, expectation of a meeting for COVID-19 treatment'companion strong...","[Tukjinju] Three Celltrions, high expectations for the Corona 19 Treatment Roundtable ..."
2020-03-23 13:27:00,코스피 장중 1500 회복…'셀트리온 3형제' 강세,Kospi intraday 1500 recovery... '3 Celltrion brothers' strong,"1500 recovery during KOSPI trading hours ... ""Celltrion 3 Brothers"" High"
2020-03-23 09:41:00,"'셀트리온' 5% 이상 상승, 주가 5일 이평선 상회, 단기·중기 이평...","'Celltrion' increased by more than 5%, stock price exceeded the moving average on the 5th, short- and mid-term profitability...","'셀트 리온' 5% 이상 상승, 주가 5 일 이평선 상회, 단기 · 중기 이평 ..."
2020-03-22 10:06:00,[마켓포인트]코스피 주간 개인 순매도 1위 ‘셀트리온’,"[Market Point]'Celltrion', No. 1 in KOSPI Weekly Personal Net Selling","[Market Point] KOSPI Week No. 1 individual net sales ""Celltrion"""
2020-03-20 17:31:00,"셀트리온·삼성물산…외국인, 실적개선·배당주는 샀다",Celltrion·Samsung C&T… Foreigners bought earnings improvement and dividend stocks,"Celltrion Samsung C & T ... Foreigners, improved achievements, Bedangu bought"
2020-03-20 14:41:00,"서정진 셀트리온 회장, 23일 코로나 치료제 임상 시점 공개","서정진 셀트리온 회장, 23일 코로나 치료제 임상 시점 공개",Chairman Seo Jung Jin Sertorion releases clinical time of corona drug on 23rd
2020-03-20 11:20:00,"'셀트리온' 5% 이상 상승, 주가 반등 시도, 단기·중기 이평선 역배...","'셀트리온' 5% 이상 상승, 주가 반등 시도, 단기·중기 이평선 역배...","""Celltrion"" Rising by more than 5%, trying to rebound stock prices, short-term and medium-term Ipyungsungyokube ..."
2020-03-23 09:49:00,'코로나19 치료제' 간담회 앞두고 셀트리온 3사 급등…셀트리온제약 1...,'코로나19 치료제' 간담회 앞두고 셀트리온 3사 급등…셀트리온제약 1...,"""Corona 19 remedy"" Round-table conference waiting for Celltrion 3 companies soaring ... Celltrion Pharmaceutical 1 ..."
